{
  "ok": true,
  "requestId": "req-open-002",
  "sessionId": "sid-demo-001",
  "requestCounter": 2,
  "stateVersion": 2,
  "wallet": {
    "balanceMinor": 150000,
    "currencyCode": "EUR",
    "delayedWalletMessages": false
  },
  "round": null,
  "feature": null,
  "presentationPayload": null,
  "restore": {
    "hasUnfinishedRound": false,
    "resumeRef": "resume-ref-001"
  },
  "idempotency": {
    "key": "open-2",
    "clientOperationId": "open-2",
    "replayed": false
  },
  "retry": {
    "allowed": false
  }
}
